{
    "show": "Random Awesomeness",
    "slug": "random-awesomeness",
    "summary": {
        "count": 731,
        "uploaded": 731,
        "missing": 0,
        "incomplete": 0,
        "removed": 0
    },
    "data": [
        {
            "title": "Wiz VS Boomstick RAP BATTLE! Written by YOU!",
            "id": "5247",
            "slug": "random-awesomeness-season-1-wiz-vs-boomstick-rap-b-a-t-t-l-e-written-by-y-o-u",
            "date": "2017-02-21",
            "is_first": false,
            "is_uploaded": true,
            "is_complete_upload": true,
            "is_removed": false
        },
        {
            "title": "Everything Changes... NOW!",
            "id": "5248",
            "slug": "random-awesomeness-season-1-everything-changes-n-o-w",
            "date": "2016-10-10",
            "is_first": false,
            "is_uploaded": true,
            "is_complete_upload": true,
            "is_removed": false
        },
        {
            "title": "Craig Skitzfamous \"Buy\" Music Video",
            "id": "5249",
            "slug": "random-awesomeness-season-1-craig-skitzfamous-buy-music-video",
            "date": "2016-09-16",
            "is_first": false,
            "is_uploaded": true,
            "is_complete_upload": true,
            "is_removed": false
        },
        {
            "title": "A Mobile Game For Gamers??",
            "id": "5250",
            "slug": "random-awesomeness-season-1-a-mobile-game-for-gamers",
            "date": "2016-08-18",
            "is_first": false,
            "is_uploaded": true,
            "is_complete_upload": true,
            "is_removed": false
        },
        {
            "title": "The Famous AMIIBO COCKFIGHT at SGC 2016",
            "id": "5251",
            "slug": "random-awesomeness-season-1-the-famous-amiibo-cockfight-at-sgc-2016",
            "date": "2016-07-08",
            "is_first": false,
            "is_uploaded": true,
            "is_complete_upload": true,
            "is_removed": false
        },
        {
            "title": "SMASH BROS Tournament with Jirard the Completionist!",
            "id": "5252",
            "slug": "random-awesomeness-season-1-smash-bros-tournament-with-jirard-the-completionist",
            "date": "2016-07-08",
            "is_first": false,
            "is_uploaded": true,
            "is_complete_upload": true,
            "is_removed": false
        },
        {
            "title": "Stuttering Craig's GAMESHOW OF AWESOMENESS",
            "id": "5254",
            "slug": "random-awesomeness-season-1-stuttering-craig-s-gameshow-of-awesomeness",
            "date": "2016-07-07",
            "is_first": false,
            "is_uploaded": true,
            "is_complete_upload": true,
            "is_removed": false
        },
        {
            "title": "ScrewAttack vs Kinda Funny from SGC 2016",
            "id": "5253",
            "slug": "random-awesomeness-season-1-screw-attack-vs-kinda-funny-from-sgc-2016",
            "date": "2016-07-07",
            "is_first": false,
            "is_uploaded": true,
            "is_complete_upload": true,
            "is_removed": false
        },
        {
            "title": "Mario Party After Dark - SGC 2016 Full Game",
            "id": "5256",
            "slug": "random-awesomeness-season-1-mario-party-after-dark-sgc-2016-full-game",
            "date": "2016-07-06",
            "is_first": false,
            "is_uploaded": true,
            "is_complete_upload": true,
            "is_removed": false
        },
        {
            "title": "Mario Kart 8: Don't Drink & Drive",
            "id": "5255",
            "slug": "random-awesomeness-season-1-mario-kart-8-don-t-drink-drive",
            "date": "2016-07-06",
            "is_first": false,
            "is_uploaded": true,
            "is_complete_upload": true,
            "is_removed": false
        },
        {
            "title": "Million Dollars But... Would You Taste Your Own Dick? | Million Dollars But.... Live Stream Archive",
            "id": "5257",
            "slug": "random-awesomeness-season-1-million-dollars-but-would-you-taste-your-own-dick-million-dollars-but-live-stream-archive",
            "date": "2016-06-10",
            "is_first": false,
            "is_uploaded": true,
            "is_complete_upload": true,
            "is_removed": false
        },
        {
            "title": "Amiibos Will DIE at SGC 2016!",
            "id": "5259",
            "slug": "random-awesomeness-season-1-amiibos-will-die-at-sgc-2016",
            "date": "2016-05-29",
            "is_first": false,
            "is_uploaded": true,
            "is_complete_upload": true,
            "is_removed": false
        },
        {
            "title": "The Completionist, ProJared, Funhaus, brentalfloss and MORE at SGC 2016",
            "id": "5258",
            "slug": "random-awesomeness-season-1-the-completionist-pro-jared-funhaus-brentalfloss-and-more-at-sgc-2016",
            "date": "2016-05-26",
            "is_first": false,
            "is_uploaded": true,
            "is_complete_upload": true,
            "is_removed": false
        },
        {
            "title": "Save up to 75% on ScrewAttack Games!",
            "id": "5274",
            "slug": "random-awesomeness-season-1-save-up-to-75-on-screw-attack-games",
            "date": "2016-05-24",
            "is_first": false,
            "is_uploaded": true,
            "is_complete_upload": true,
            "is_removed": false
        },
        {
            "title": "Let's Play Live! - We'll Murder EVERYONE!",
            "id": "5260",
            "slug": "random-awesomeness-season-1-let-s-play-live-we-ll-murder-e-v-e-r-y-o-n-e",
            "date": "2016-04-18",
            "is_first": false,
            "is_uploaded": true,
            "is_complete_upload": true,
            "is_removed": false
        },
        {
            "title": "ScrewAttack & Achievement Hunter are The Bad Guys",
            "id": "5262",
            "slug": "random-awesomeness-season-1-screw-attack-achievement-hunter-are-the-bad-guys",
            "date": "2016-04-10",
            "is_first": false,
            "is_uploaded": true,
            "is_complete_upload": true,
            "is_removed": false
        },
        {
            "title": "The Video Game Vault is BACK!",
            "id": "5261",
            "slug": "random-awesomeness-season-1-the-video-game-vault-is-b-a-c-k",
            "date": "2016-04-09",
            "is_first": false,
            "is_uploaded": true,
            "is_complete_upload": true,
            "is_removed": false
        },
        {
            "title": "Substitute Teacher Story Time! | SideScrollers Extended Cut 02/10/16",
            "id": "6187",
            "slug": "substitute-teacher-story-time-sidescrollers-extended-cut-021016",
            "date": "2016-02-10",
            "is_first": false,
            "is_uploaded": true,
            "is_complete_upload": true,
            "is_removed": false
        },
        {
            "title": "The #1 Show - What's the Best 90's Action Film?",
            "id": "6186",
            "slug": "the-1-show-whats-the-best-90s-action-film",
            "date": "2016-01-28",
            "is_first": false,
            "is_uploaded": true,
            "is_complete_upload": true,
            "is_removed": false
        },
        {
            "title": "Chad's Crazy Past | SideScrollers Extended Cut 01/27/16",
            "id": "6185",
            "slug": "chads-crazy-past-sidescrollers-extended-cut-012716",
            "date": "2016-01-27",
            "is_first": false,
            "is_uploaded": true,
            "is_complete_upload": true,
            "is_removed": false
        },
        {
            "title": "SERIES PREVIEW - The #1 Show - Pizza",
            "id": "6184",
            "slug": "series-preview-the-1-show-pizza",
            "date": "2016-01-27",
            "is_first": false,
            "is_uploaded": true,
            "is_complete_upload": true,
            "is_removed": false
        },
        {
            "title": "Nick's Dark Legacy | SideScrollers Extended Cut",
            "id": "6183",
            "slug": "nicks-dark-legacy-sidescrollers-extended-cut",
            "date": "2016-01-20",
            "is_first": false,
            "is_uploaded": true,
            "is_complete_upload": true,
            "is_removed": false
        },
        {
            "title": "Meet DeeJay! | SideScrollers Extended Cut 01/13/16",
            "id": "6182",
            "slug": "meet-deejay-sidescrollers-extended-cut-011316",
            "date": "2016-01-14",
            "is_first": false,
            "is_uploaded": true,
            "is_complete_upload": true,
            "is_removed": false
        },
        {
            "title": "ANNOUNCING g1 of the YEAR 2015!",
            "id": "6181",
            "slug": "announcing-g1-of-the-year-2015",
            "date": "2016-01-11",
            "is_first": false,
            "is_uploaded": true,
            "is_complete_upload": true,
            "is_removed": false
        },
        {
            "title": "Drugs, Man! | SideScrollers Extended Cut 01/06/16",
            "id": "6180",
            "slug": "drugs-man-sidescrollers-extended-cut-010616",
            "date": "2016-01-06",
            "is_first": false,
            "is_uploaded": true,
            "is_complete_upload": true,
            "is_removed": false
        },
        {
            "title": "Pet Sounds | SideScrollers Extended Cut",
            "id": "6179",
            "slug": "pet-sounds-sidescrollers-extended-cut",
            "date": "2015-12-30",
            "is_first": false,
            "is_uploaded": true,
            "is_complete_upload": true,
            "is_removed": false
        },
        {
            "title": "The 2015 ScrewAttack Royal Rumble",
            "id": "6178",
            "slug": "the-2015-screwattack-royal-rumble",
            "date": "2015-12-30",
            "is_first": false,
            "is_uploaded": true,
            "is_complete_upload": true,
            "is_removed": false
        },
        {
            "title": "Only in Japan | SideScrollers Extended Cut 12/23/15",
            "id": "6177",
            "slug": "only-in-japan-sidescrollers-extended-cut-122315",
            "date": "2015-12-23",
            "is_first": false,
            "is_uploaded": true,
            "is_complete_upload": true,
            "is_removed": false
        },
        {
            "title": "Fairly Odd Relatives",
            "id": "6176",
            "slug": "fairly-odd-relatives",
            "date": "2015-12-16",
            "is_first": false,
            "is_uploaded": true,
            "is_complete_upload": true,
            "is_removed": false
        },
        {
            "title": "Community Project: The Games that Defined 2015",
            "id": "6175",
            "slug": "community-project-the-games-that-defined-2015",
            "date": "2015-12-11",
            "is_first": false,
            "is_uploaded": true,
            "is_complete_upload": true,
            "is_removed": false
        },
        {
            "title": "Sam Has More Victims! | SideScrollers Extended Cut",
            "id": "6174",
            "slug": "sam-has-more-victims-sidescrollers-extended-cut",
            "date": "2015-12-09",
            "is_first": false,
            "is_uploaded": true,
            "is_complete_upload": true,
            "is_removed": false
        },
        {
            "title": "A Case For Top 10 Slides | SideScrollers Extended Cut",
            "id": "6173",
            "slug": "a-case-for-top-10-slides-sidescrollers-extended-cut",
            "date": "2015-11-25",
            "is_first": false,
            "is_uploaded": true,
            "is_complete_upload": true,
            "is_removed": false
        },
        {
            "title": "Here Comes The Money | SideScrollers Extended Cut 11/18/15",
            "id": "6172",
            "slug": "here-comes-the-money-sidescrollers-extended-cut-111815",
            "date": "2015-11-18",
            "is_first": false,
            "is_uploaded": true,
            "is_complete_upload": true,
            "is_removed": false
        },
        {
            "title": "How Much Would It Cost...",
            "id": "6170",
            "slug": "how-much-would-it-cost",
            "date": "2015-11-11",
            "is_first": false,
            "is_uploaded": true,
            "is_complete_upload": true,
            "is_removed": false
        },
        {
            "title": "The Extended Cut About Nothing | SideScrollers Extended Cut",
            "id": "6171",
            "slug": "the-extended-cut-about-nothing-sidescrollers-extended-cut",
            "date": "2015-11-05",
            "is_first": false,
            "is_uploaded": true,
            "is_complete_upload": true,
            "is_removed": false
        },
        {
            "title": "Chad And Hip-Hop Don't Mix | Extended Cut",
            "id": "6169",
            "slug": "chad-and-hip-hop-dont-mix-extended-cut",
            "date": "2015-10-29",
            "is_first": false,
            "is_uploaded": true,
            "is_complete_upload": true,
            "is_removed": false
        },
        {
            "title": "Carving Pumpkins! | SideScrollers Extended Cut",
            "id": "6168",
            "slug": "carving-pumpkins-sidescrollers-extended-cut",
            "date": "2015-10-21",
            "is_first": false,
            "is_uploaded": true,
            "is_complete_upload": true,
            "is_removed": false
        },
        {
            "title": "SideScrollers Extended Cut 10/14/15",
            "id": "6167",
            "slug": "sidescrollers-extended-cut-101415",
            "date": "2015-10-14",
            "is_first": false,
            "is_uploaded": true,
            "is_complete_upload": true,
            "is_removed": false
        },
        {
            "title": "So Many Cameras | SideScrollers Extended Cut",
            "id": "6165",
            "slug": "so-many-cameras-sidescrollers-extended-cut",
            "date": "2015-10-10",
            "is_first": false,
            "is_uploaded": true,
            "is_complete_upload": true,
            "is_removed": false
        },
        {
            "title": "SideScrollers Extended Cut 10/2/15",
            "id": "6166",
            "slug": "sidescrollers-extended-cut-10215",
            "date": "2015-10-03",
            "is_first": false,
            "is_uploaded": true,
            "is_complete_upload": true,
            "is_removed": false
        },
        {
            "title": "SideScrollers Extended Cut 09/25/15",
            "id": "6164",
            "slug": "sidescrollers-extended-cut-092515",
            "date": "2015-09-26",
            "is_first": false,
            "is_uploaded": true,
            "is_complete_upload": true,
            "is_removed": false
        },
        {
            "title": "SideScrollers Extended Cut 09/19/15",
            "id": "6163",
            "slug": "sidescrollers-extended-cut-091915",
            "date": "2015-09-19",
            "is_first": false,
            "is_uploaded": true,
            "is_complete_upload": true,
            "is_removed": false
        },
        {
            "title": "SideScrollers Extended Cut 09/11/15",
            "id": "6162",
            "slug": "sidescrollers-extended-cut-091115",
            "date": "2015-09-12",
            "is_first": false,
            "is_uploaded": true,
            "is_complete_upload": true,
            "is_removed": false
        },
        {
            "title": "DICKS",
            "id": "6161",
            "slug": "dicks",
            "date": "2015-09-11",
            "is_first": false,
            "is_uploaded": true,
            "is_complete_upload": true,
            "is_removed": false
        },
        {
            "title": "\"The Industry\" Debut Trailer",
            "id": "6160",
            "slug": "the-industry-debut-trailer",
            "date": "2015-09-08",
            "is_first": false,
            "is_uploaded": true,
            "is_complete_upload": true,
            "is_removed": false
        },
        {
            "title": "SideScrollers Extended Cut 09/04/15",
            "id": "6159",
            "slug": "sidescrollers-extended-cut-090415",
            "date": "2015-09-04",
            "is_first": false,
            "is_uploaded": true,
            "is_complete_upload": true,
            "is_removed": false
        },
        {
            "title": "SideScrollers Extended Cut 08/28/15",
            "id": "6158",
            "slug": "sidescrollers-extended-cut-082815",
            "date": "2015-08-28",
            "is_first": false,
            "is_uploaded": true,
            "is_complete_upload": true,
            "is_removed": false
        },
        {
            "title": "Jackie Chan Hates his Son!?",
            "id": "6157",
            "slug": "jackie-chan-hates-his-son",
            "date": "2015-08-28",
            "is_first": false,
            "is_uploaded": true,
            "is_complete_upload": true,
            "is_removed": false
        },
        {
            "title": "SideScrollers Extended Cut 08/14/15",
            "id": "6156",
            "slug": "sidescrollers-extended-cut-081415",
            "date": "2015-08-15",
            "is_first": false,
            "is_uploaded": true,
            "is_complete_upload": true,
            "is_removed": false
        },
        {
            "title": "What new shows are coming to ScrewAttack?",
            "id": "6155",
            "slug": "what-new-shows-are-coming-to-screwattack",
            "date": "2015-08-01",
            "is_first": false,
            "is_uploaded": true,
            "is_complete_upload": true,
            "is_removed": false
        },
        {
            "title": "SUPERMAN DIES",
            "id": "6153",
            "slug": "superman-dies",
            "date": "2015-07-28",
            "is_first": false,
            "is_uploaded": true,
            "is_complete_upload": true,
            "is_removed": false
        },
        {
            "title": "ScrewAttack Advantage - 06/19/2015",
            "id": "6154",
            "slug": "screwattack-advantage-06192015",
            "date": "2015-06-29",
            "is_first": false,
            "is_uploaded": true,
            "is_complete_upload": true,
            "is_removed": false
        },
        {
            "title": "SideScrollers Extended Cut 06/26/15",
            "id": "6152",
            "slug": "sidescrollers-extended-cut-062615",
            "date": "2015-06-29",
            "is_first": false,
            "is_uploaded": true,
            "is_complete_upload": true,
            "is_removed": false
        },
        {
            "title": "What other crazy S&#@ did we do at E3? | Outtakes",
            "id": "6151",
            "slug": "what-other-crazy-s-did-we-do-at-e3-outtakes",
            "date": "2015-06-19",
            "is_first": false,
            "is_uploaded": true,
            "is_complete_upload": true,
            "is_removed": false
        },
        {
            "title": "SideScrollers Extended Cut 06/13/15",
            "id": "6150",
            "slug": "sidescrollers-extended-cut-061315",
            "date": "2015-06-13",
            "is_first": false,
            "is_uploaded": true,
            "is_complete_upload": true,
            "is_removed": false
        },
        {
            "title": "BEHIND THE SCENES OF WRITING DEATH BATTLE!",
            "id": "6149",
            "slug": "behind-the-scenes-of-writing-death-battle",
            "date": "2015-06-06",
            "is_first": false,
            "is_uploaded": true,
            "is_complete_upload": true,
            "is_removed": false
        },
        {
            "title": "The Great Sphero Obstacle Course",
            "id": "6148",
            "slug": "the-great-sphero-obstacle-course",
            "date": "2015-06-04",
            "is_first": false,
            "is_uploaded": true,
            "is_complete_upload": true,
            "is_removed": false
        },
        {
            "title": "SideScrollers Extended Cut 05/29/15",
            "id": "6146",
            "slug": "sidescrollers-extended-cut-052915",
            "date": "2015-05-30",
            "is_first": false,
            "is_uploaded": true,
            "is_complete_upload": true,
            "is_removed": false
        },
        {
            "title": "Amiibottles!",
            "id": "6147",
            "slug": "amiibottles",
            "date": "2015-05-11",
            "is_first": false,
            "is_uploaded": true,
            "is_complete_upload": true,
            "is_removed": false
        },
        {
            "title": "SideScrollers Extended Cut 05/09/15",
            "id": "6145",
            "slug": "sidescrollers-extended-cut-050915",
            "date": "2015-05-11",
            "is_first": false,
            "is_uploaded": true,
            "is_complete_upload": true,
            "is_removed": false
        },
        {
            "title": "ScrewAttack Story Time: Shaun's Disturbing Childhood",
            "id": "6144",
            "slug": "screwattack-story-time-shauns-disturbing-childhood",
            "date": "2015-05-05",
            "is_first": false,
            "is_uploaded": true,
            "is_complete_upload": true,
            "is_removed": false
        },
        {
            "title": "SideScrollers Extended Cut 05/02/15",
            "id": "6143",
            "slug": "sidescrollers-extended-cut-050215",
            "date": "2015-05-03",
            "is_first": false,
            "is_uploaded": true,
            "is_complete_upload": true,
            "is_removed": false
        },
        {
            "title": "SideScrollers Extended Cut 04/25/15",
            "id": "6142",
            "slug": "sidescrollers-extended-cut-042515",
            "date": "2015-04-25",
            "is_first": false,
            "is_uploaded": true,
            "is_complete_upload": true,
            "is_removed": false
        },
        {
            "title": "Shaun Gets Too Meta | The Best EVER! Extended",
            "id": "6141",
            "slug": "shaun-gets-too-meta-the-best-ever-extended",
            "date": "2015-04-23",
            "is_first": false,
            "is_uploaded": true,
            "is_complete_upload": true,
            "is_removed": false
        },
        {
            "title": "SideScrollers Extended Cut 04/11/15",
            "id": "6140",
            "slug": "sidescrollers-extended-cut-041115",
            "date": "2015-04-11",
            "is_first": false,
            "is_uploaded": true,
            "is_complete_upload": true,
            "is_removed": false
        },
        {
            "title": "What Super Powers would we have?",
            "id": "6139",
            "slug": "what-super-powers-would-we-have",
            "date": "2015-04-06",
            "is_first": false,
            "is_uploaded": true,
            "is_complete_upload": true,
            "is_removed": false
        },
        {
            "title": "SideScrollers Extended Cut 04/04/15",
            "id": "6138",
            "slug": "sidescrollers-extended-cut-040415",
            "date": "2015-04-04",
            "is_first": false,
            "is_uploaded": true,
            "is_complete_upload": true,
            "is_removed": false
        },
        {
            "title": "Chuck Vs. Segata in the Soundbooth!",
            "id": "6137",
            "slug": "chuck-vs-segata-in-the-soundbooth",
            "date": "2015-03-30",
            "is_first": false,
            "is_uploaded": true,
            "is_complete_upload": true,
            "is_removed": false
        },
        {
            "title": "SideScrollers Extended Cut 03/28/15",
            "id": "6136",
            "slug": "sidescrollers-extended-cut-032815",
            "date": "2015-03-28",
            "is_first": false,
            "is_uploaded": true,
            "is_complete_upload": true,
            "is_removed": false
        },
        {
            "title": "SideScrollers Extended Cut 03/21/15",
            "id": "6135",
            "slug": "sidescrollers-extended-cut-032115",
            "date": "2015-03-21",
            "is_first": false,
            "is_uploaded": true,
            "is_complete_upload": true,
            "is_removed": false
        },
        {
            "title": "Watch Parker Get Slapped in the face! | Destiny BTS",
            "id": "6134",
            "slug": "watch-parker-get-slapped-in-the-face-destiny-bts",
            "date": "2015-03-16",
            "is_first": false,
            "is_uploaded": true,
            "is_complete_upload": true,
            "is_removed": false
        },
        {
            "title": "SideScrollers Extended Cut 03/07/15",
            "id": "6133",
            "slug": "sidescrollers-extended-cut-030715",
            "date": "2015-03-07",
            "is_first": false,
            "is_uploaded": true,
            "is_complete_upload": true,
            "is_removed": false
        },
        {
            "title": "Sega Channel Visits ScrewAttack",
            "id": "6132",
            "slug": "sega-channel-visits-screwattack",
            "date": "2015-03-03",
            "is_first": false,
            "is_uploaded": true,
            "is_complete_upload": true,
            "is_removed": false
        },
        {
            "title": "SideScrollers Extended Cut 02/28/15",
            "id": "6131",
            "slug": "sidescrollers-extended-cut-022815",
            "date": "2015-02-28",
            "is_first": false,
            "is_uploaded": true,
            "is_complete_upload": true,
            "is_removed": false
        },
        {
            "title": "We DON'T have what it takes to wield weapons.",
            "id": "6130",
            "slug": "we-dont-have-what-it-takes-to-wield-weapons",
            "date": "2015-02-24",
            "is_first": false,
            "is_uploaded": true,
            "is_complete_upload": true,
            "is_removed": false
        },
        {
            "title": "Get to know Dusty - one of our new interns!",
            "id": "6129",
            "slug": "get-to-know-dusty-one-of-our-new-interns",
            "date": "2015-02-20",
            "is_first": false,
            "is_uploaded": true,
            "is_complete_upload": true,
            "is_removed": false
        },
        {
            "title": "SideScrollers Extended Cut 02/14/15",
            "id": "6128",
            "slug": "sidescrollers-extended-cut-021415",
            "date": "2015-02-14",
            "is_first": false,
            "is_uploaded": true,
            "is_complete_upload": true,
            "is_removed": false
        },
        {
            "title": "SideScrollers Extended Cut 02/07/15",
            "id": "6127",
            "slug": "sidescrollers-extended-cut-020715",
            "date": "2015-02-07",
            "is_first": false,
            "is_uploaded": true,
            "is_complete_upload": true,
            "is_removed": false
        },
        {
            "title": "Hot Pepper Gaming | Ben Singer Reviews Sonic Boom",
            "id": "6126",
            "slug": "hot-pepper-gaming-ben-singer-reviews-sonic-boom",
            "date": "2015-02-03",
            "is_first": false,
            "is_uploaded": true,
            "is_complete_upload": true,
            "is_removed": false
        },
        {
            "title": "SideScrollers Extended 1/31/15",
            "id": "6125",
            "slug": "sidescrollers-extended-13115",
            "date": "2015-01-31",
            "is_first": false,
            "is_uploaded": true,
            "is_complete_upload": true,
            "is_removed": false
        },
        {
            "title": "Here's what you missed from our PAX South Arcade!",
            "id": "6123",
            "slug": "heres-what-you-missed-from-our-pax-south-arcade",
            "date": "2015-01-29",
            "is_first": false,
            "is_uploaded": true,
            "is_complete_upload": true,
            "is_removed": false
        },
        {
            "title": "Thank You So Much",
            "id": "6124",
            "slug": "thank-you-so-much",
            "date": "2015-01-20",
            "is_first": false,
            "is_uploaded": true,
            "is_complete_upload": true,
            "is_removed": false
        },
        {
            "title": "A Genesis Classic | Lootcrate Retro Game Challenge Game #1",
            "id": "6122",
            "slug": "a-genesis-classic-lootcrate-retro-game-challenge-game-1",
            "date": "2015-01-20",
            "is_first": false,
            "is_uploaded": true,
            "is_complete_upload": true,
            "is_removed": false
        },
        {
            "title": "Big Money! Big Prizes! Big DEATH! | Lootcrate Retro Game Challenge Game #2",
            "id": "6121",
            "slug": "big-money-big-prizes-big-death-lootcrate-retro-game-challenge-game-2",
            "date": "2015-01-20",
            "is_first": false,
            "is_uploaded": true,
            "is_complete_upload": true,
            "is_removed": false
        },
        {
            "title": "It's all about SPEED! | Lootcrate Retro Game Challenge Game #3",
            "id": "6120",
            "slug": "its-all-about-speed-lootcrate-retro-game-challenge-game-3",
            "date": "2015-01-20",
            "is_first": false,
            "is_uploaded": true,
            "is_complete_upload": true,
            "is_removed": false
        },
        {
            "title": "SideScrollers Extended Cut 01/17/15",
            "id": "6119",
            "slug": "sidescrollers-extended-cut-011715",
            "date": "2015-01-17",
            "is_first": false,
            "is_uploaded": true,
            "is_complete_upload": true,
            "is_removed": false
        },
        {
            "title": "Sam vs John - Reese's One Pound Eating Challenge",
            "id": "6118",
            "slug": "sam-vs-john-reeses-one-pound-eating-challenge",
            "date": "2015-01-16",
            "is_first": false,
            "is_uploaded": true,
            "is_complete_upload": true,
            "is_removed": false
        },
        {
            "title": "Taken 3 Roundtable *SPOILERS*",
            "id": "6117",
            "slug": "taken-3-roundtable-spoilers",
            "date": "2015-01-10",
            "is_first": false,
            "is_uploaded": true,
            "is_complete_upload": true,
            "is_removed": false
        },
        {
            "title": "DEATH BATTLE! Behind-the-Scenes - Ragna Vs. Sol Badguy | Advantage Content",
            "id": "6116",
            "slug": "death-battle-behind-the-scenes-ragna-vs-sol-badguy-advantage-content",
            "date": "2015-01-09",
            "is_first": false,
            "is_uploaded": true,
            "is_complete_upload": true,
            "is_removed": false
        },
        {
            "title": "Happy New Year! Get your free game!",
            "id": "6115",
            "slug": "happy-new-year-get-your-free-game",
            "date": "2014-12-30",
            "is_first": false,
            "is_uploaded": true,
            "is_complete_upload": true,
            "is_removed": false
        },
        {
            "title": "ScrewAttack Wrestling Royal Rumble 2014",
            "id": "6114",
            "slug": "screwattack-wrestling-royal-rumble-2014",
            "date": "2014-12-25",
            "is_first": false,
            "is_uploaded": true,
            "is_complete_upload": true,
            "is_removed": false
        },
        {
            "title": "12/24/14 SideScrollers Extended Cut",
            "id": "6113",
            "slug": "122414-sidescrollers-extended-cut",
            "date": "2014-12-24",
            "is_first": false,
            "is_uploaded": true,
            "is_complete_upload": true,
            "is_removed": false
        },
        {
            "title": "Death of the Hard News Desk",
            "id": "6112",
            "slug": "death-of-the-hard-news-desk",
            "date": "2014-12-19",
            "is_first": false,
            "is_uploaded": true,
            "is_complete_upload": true,
            "is_removed": false
        },
        {
            "title": "DEATH BATTLE! Sound Booth Outtakes | Kirby vs. Majin Buu",
            "id": "6111",
            "slug": "death-battle-sound-booth-outtakes-kirby-vs-majin-buu",
            "date": "2014-12-18",
            "is_first": false,
            "is_uploaded": true,
            "is_complete_upload": true,
            "is_removed": false
        },
        {
            "title": "12/17/14 SideScrollers Extended Cut",
            "id": "6110",
            "slug": "121714-sidescrollers-extended-cut",
            "date": "2014-12-17",
            "is_first": false,
            "is_uploaded": true,
            "is_complete_upload": true,
            "is_removed": false
        },
        {
            "title": "The Story of GameJew",
            "id": "6109",
            "slug": "the-story-of-gamejew",
            "date": "2014-12-16",
            "is_first": false,
            "is_uploaded": true,
            "is_complete_upload": true,
            "is_removed": false
        },
        {
            "title": "Create Your Dreams in WWE 2K15",
            "id": "6108",
            "slug": "create-your-dreams-in-wwe-2k15",
            "date": "2014-12-14",
            "is_first": false,
            "is_uploaded": true,
            "is_complete_upload": true,
            "is_removed": false
        },
        {
            "title": "Best Gameplay Nominees | ScrewAttack's End of the Year Awards",
            "id": "6106",
            "slug": "best-gameplay-nominees-screwattacks-end-of-the-year-awards",
            "date": "2014-12-11",
            "is_first": false,
            "is_uploaded": true,
            "is_complete_upload": true,
            "is_removed": false
        },
        {
            "title": "Best Story Nominees | ScrewAttack's End of the Year Awards",
            "id": "6105",
            "slug": "best-story-nominees-screwattacks-end-of-the-year-awards",
            "date": "2014-12-11",
            "is_first": false,
            "is_uploaded": true,
            "is_complete_upload": true,
            "is_removed": false
        },
        {
            "title": "12/10/14 SideScrollers Extended Cut",
            "id": "6107",
            "slug": "121014-sidescrollers-extended-cut",
            "date": "2014-12-10",
            "is_first": false,
            "is_uploaded": true,
            "is_complete_upload": true,
            "is_removed": false
        },
        {
            "title": "Foxitron gets A SIDEKICK!",
            "id": "6104",
            "slug": "foxitron-gets-a-sidekick",
            "date": "2014-12-07",
            "is_first": false,
            "is_uploaded": true,
            "is_complete_upload": true,
            "is_removed": false
        },
        {
            "title": "Street Fighter 5: What We THINK We Know",
            "id": "6103",
            "slug": "street-fighter-5-what-we-think-we-know",
            "date": "2014-12-07",
            "is_first": false,
            "is_uploaded": true,
            "is_complete_upload": true,
            "is_removed": false
        },
        {
            "title": "Chad Vs. Nick - TAUNTS ONLY | SF: Third Strike",
            "id": "6102",
            "slug": "chad-vs-nick-taunts-only-sf-third-strike",
            "date": "2014-12-04",
            "is_first": false,
            "is_uploaded": true,
            "is_complete_upload": true,
            "is_removed": false
        },
        {
            "title": "Let's Learn Kung Fu Episode 1 REDUX | Tornado Kick",
            "id": "6101",
            "slug": "lets-learn-kung-fu-episode-1-redux-tornado-kick",
            "date": "2014-12-04",
            "is_first": false,
            "is_uploaded": true,
            "is_complete_upload": true,
            "is_removed": false
        },
        {
            "title": "12/03/14 Extended Cut",
            "id": "6099",
            "slug": "120314-extended-cut",
            "date": "2014-12-03",
            "is_first": false,
            "is_uploaded": true,
            "is_complete_upload": true,
            "is_removed": false
        },
        {
            "title": "Jedi vs Ninja vs Knight vs Fencer (Live Action Battle)",
            "id": "6100",
            "slug": "jedi-vs-ninja-vs-knight-vs-fencer-live-action-battle",
            "date": "2014-11-26",
            "is_first": false,
            "is_uploaded": true,
            "is_complete_upload": true,
            "is_removed": false
        },
        {
            "title": "The FOXINING | DC Universe Online Part 2",
            "id": "6098",
            "slug": "the-foxining-dc-universe-online-part-2",
            "date": "2014-11-24",
            "is_first": false,
            "is_uploaded": true,
            "is_complete_upload": true,
            "is_removed": false
        },
        {
            "title": "Destiny Screws Over Sean",
            "id": "6097",
            "slug": "destiny-screws-over-sean",
            "date": "2014-11-22",
            "is_first": false,
            "is_uploaded": true,
            "is_complete_upload": true,
            "is_removed": false
        },
        {
            "title": "SideScrollers Extended Cut 11/19/14",
            "id": "6096",
            "slug": "sidescrollers-extended-cut-111914",
            "date": "2014-11-19",
            "is_first": false,
            "is_uploaded": true,
            "is_complete_upload": true,
            "is_removed": false
        },
        {
            "title": "Destiny in Real Life... Sort Of",
            "id": "6095",
            "slug": "destiny-in-real-life-sort-of",
            "date": "2014-11-18",
            "is_first": false,
            "is_uploaded": true,
            "is_complete_upload": true,
            "is_removed": false
        },
        {
            "title": "The most abstract movie reference on the internet",
            "id": "6094",
            "slug": "the-most-abstract-movie-reference-on-the-internet",
            "date": "2014-11-17",
            "is_first": false,
            "is_uploaded": true,
            "is_complete_upload": true,
            "is_removed": false
        },
        {
            "title": "The Rise of FOXITRON! | DC Universe Online Pt 1",
            "id": "6092",
            "slug": "the-rise-of-foxitron-dc-universe-online-pt-1",
            "date": "2014-11-16",
            "is_first": false,
            "is_uploaded": true,
            "is_complete_upload": true,
            "is_removed": false
        },
        {
            "title": "Nick's Day of HELL",
            "id": "6091",
            "slug": "nicks-day-of-hell",
            "date": "2014-11-14",
            "is_first": false,
            "is_uploaded": true,
            "is_complete_upload": true,
            "is_removed": false
        },
        {
            "title": "The Best Corsair Gaming Unboxing Video Ever Made...EVER",
            "id": "6090",
            "slug": "the-best-corsair-gaming-unboxing-video-ever-made-ever",
            "date": "2014-11-06",
            "is_first": false,
            "is_uploaded": true,
            "is_complete_upload": true,
            "is_removed": false
        },
        {
            "title": "SideScrollers Extended Cut 11/05/14",
            "id": "6089",
            "slug": "sidescrollers-extended-cut-110514",
            "date": "2014-11-05",
            "is_first": false,
            "is_uploaded": true,
            "is_complete_upload": true,
            "is_removed": false
        },
        {
            "title": "Celebrate Alien Xmas in October!",
            "id": "6088",
            "slug": "celebrate-alien-xmas-in-october",
            "date": "2014-11-02",
            "is_first": false,
            "is_uploaded": true,
            "is_complete_upload": true,
            "is_removed": false
        },
        {
            "title": "The Pumpkin Pie Eating Challenge",
            "id": "6087",
            "slug": "the-pumpkin-pie-eating-challenge",
            "date": "2014-10-31",
            "is_first": false,
            "is_uploaded": true,
            "is_complete_upload": true,
            "is_removed": false
        },
        {
            "title": "Whipped Cream Punishment",
            "id": "6086",
            "slug": "whipped-cream-punishment",
            "date": "2014-10-31",
            "is_first": false,
            "is_uploaded": true,
            "is_complete_upload": true,
            "is_removed": false
        },
        {
            "title": "Gambit stars in the new CoD trailer!",
            "id": "6085",
            "slug": "gambit-stars-in-the-new-cod-trailer",
            "date": "2014-10-30",
            "is_first": false,
            "is_uploaded": true,
            "is_complete_upload": true,
            "is_removed": false
        },
        {
            "title": "DEATH BATTLE! Sound Booth Outtakes!",
            "id": "6084",
            "slug": "death-battle-sound-booth-outtakes",
            "date": "2014-10-30",
            "is_first": false,
            "is_uploaded": true,
            "is_complete_upload": true,
            "is_removed": false
        },
        {
            "title": "Internet All-Stars Challenge Rd. 5: Kyle Bosman",
            "id": "6083",
            "slug": "internet-all-stars-challenge-rd-5-kyle-bosman",
            "date": "2014-10-30",
            "is_first": false,
            "is_uploaded": true,
            "is_complete_upload": true,
            "is_removed": false
        },
        {
            "title": "Craig appears on HLN to talk about ScrewAttack",
            "id": "6082",
            "slug": "craig-appears-on-hln-to-talk-about-screwattack",
            "date": "2014-10-30",
            "is_first": false,
            "is_uploaded": true,
            "is_complete_upload": true,
            "is_removed": false
        },
        {
            "title": "SideScrollers Extended Cut 10/29/14",
            "id": "6081",
            "slug": "sidescrollers-extended-cut-102914",
            "date": "2014-10-29",
            "is_first": false,
            "is_uploaded": true,
            "is_complete_upload": true,
            "is_removed": false
        },
        {
            "title": "The Slap",
            "id": "6080",
            "slug": "the-slap",
            "date": "2014-10-28",
            "is_first": false,
            "is_uploaded": true,
            "is_complete_upload": true,
            "is_removed": false
        },
        {
            "title": "Why WWE Live Events are AWESOME!",
            "id": "6079",
            "slug": "why-wwe-live-events-are-awesome",
            "date": "2014-10-28",
            "is_first": false,
            "is_uploaded": true,
            "is_complete_upload": true,
            "is_removed": false
        },
        {
            "title": "Love is in the air on Live!",
            "id": "6078",
            "slug": "love-is-in-the-air-on-live",
            "date": "2014-10-26",
            "is_first": false,
            "is_uploaded": true,
            "is_complete_upload": true,
            "is_removed": false
        },
        {
            "title": "Internet All-Stars Challenge Rd. 4: Ben Singer",
            "id": "6077",
            "slug": "internet-all-stars-challenge-rd-4-ben-singer",
            "date": "2014-10-23",
            "is_first": false,
            "is_uploaded": true,
            "is_complete_upload": true,
            "is_removed": false
        },
        {
            "title": "SideScrollers Extended Cut 10/22/14",
            "id": "6076",
            "slug": "sidescrollers-extended-cut-102214",
            "date": "2014-10-22",
            "is_first": false,
            "is_uploaded": true,
            "is_complete_upload": true,
            "is_removed": false
        },
        {
            "title": "Bill Cosby + Facehugger = WTF?!?",
            "id": "6075",
            "slug": "bill-cosby-facehugger-wtf",
            "date": "2014-10-19",
            "is_first": false,
            "is_uploaded": true,
            "is_complete_upload": true,
            "is_removed": false
        },
        {
            "title": "Internet All-Stars Challenge Rd. 3: Jesse Cox",
            "id": "6074",
            "slug": "internet-all-stars-challenge-rd-3-jesse-cox",
            "date": "2014-10-16",
            "is_first": false,
            "is_uploaded": true,
            "is_complete_upload": true,
            "is_removed": false
        },
        {
            "title": "Avenged Sevenfold's Lead Singer is Making a Game!",
            "id": "6073",
            "slug": "avenged-sevenfolds-lead-singer-is-making-a-game",
            "date": "2014-10-16",
            "is_first": false,
            "is_uploaded": true,
            "is_complete_upload": true,
            "is_removed": false
        },
        {
            "title": "SideScrollers Extended Cut 10/15/14",
            "id": "6072",
            "slug": "sidescrollers-extended-cut-101514",
            "date": "2014-10-15",
            "is_first": false,
            "is_uploaded": true,
            "is_complete_upload": true,
            "is_removed": false
        },
        {
            "title": "Takahata101's DEATH BATTLE Debate",
            "id": "6071",
            "slug": "takahata101s-death-battle-debate",
            "date": "2014-10-10",
            "is_first": false,
            "is_uploaded": true,
            "is_complete_upload": true,
            "is_removed": false
        },
        {
            "title": "Internet All-Stars Challenge Rd. 2: Gametrailers' Brandon Jones",
            "id": "6070",
            "slug": "internet-all-stars-challenge-rd-2-gametrailers-brandon-jones",
            "date": "2014-10-09",
            "is_first": false,
            "is_uploaded": true,
            "is_complete_upload": true,
            "is_removed": false
        },
        {
            "title": "SideScrollers Extended Cut 10/08/14",
            "id": "6069",
            "slug": "sidescrollers-extended-cut-100814",
            "date": "2014-10-08",
            "is_first": false,
            "is_uploaded": true,
            "is_complete_upload": true,
            "is_removed": false
        },
        {
            "title": "**NEW SHOW** Internet All-Stars Challenge Rd. 1: Machinima's Adam Kovic",
            "id": "6068",
            "slug": "new-show-internet-all-stars-challenge-rd-1-machinimas-adam-kovic",
            "date": "2014-10-05",
            "is_first": false,
            "is_uploaded": true,
            "is_complete_upload": true,
            "is_removed": false
        },
        {
            "title": "SideScrollers Extended Cut 10/01/14",
            "id": "6067",
            "slug": "sidescrollers-extended-cut-100114",
            "date": "2014-10-01",
            "is_first": false,
            "is_uploaded": true,
            "is_complete_upload": true,
            "is_removed": false
        },
        {
            "title": "SideScrollers Extended Cut 09/24/14",
            "id": "6066",
            "slug": "sidescrollers-extended-cut-092414",
            "date": "2014-09-24",
            "is_first": false,
            "is_uploaded": true,
            "is_complete_upload": true,
            "is_removed": false
        },
        {
            "title": "SMITE - The God of Retro",
            "id": "6065",
            "slug": "smite-the-god-of-retro",
            "date": "2014-09-22",
            "is_first": false,
            "is_uploaded": true,
            "is_complete_upload": true,
            "is_removed": false
        },
        {
            "title": "SideScrollers Extended Cut 09/16/14",
            "id": "6064",
            "slug": "sidescrollers-extended-cut-091614",
            "date": "2014-09-18",
            "is_first": false,
            "is_uploaded": true,
            "is_complete_upload": true,
            "is_removed": false
        },
        {
            "title": "THE GREAT GAMEWORKS TAKEDOWN!",
            "id": "6063",
            "slug": "the-great-gameworks-takedown",
            "date": "2014-09-12",
            "is_first": false,
            "is_uploaded": true,
            "is_complete_upload": true,
            "is_removed": false
        },
        {
            "title": "Assassin's Creed Betrays the Order by going Rogue | PAXPrime 2014",
            "id": "6062",
            "slug": "assassins-creed-betrays-the-order-by-going-rogue-paxprime-2014",
            "date": "2014-09-10",
            "is_first": false,
            "is_uploaded": true,
            "is_complete_upload": true,
            "is_removed": false
        },
        {
            "title": "SideScrollers Extended Cut 09/10/14",
            "id": "6061",
            "slug": "sidescrollers-extended-cut-091014",
            "date": "2014-09-10",
            "is_first": false,
            "is_uploaded": true,
            "is_complete_upload": true,
            "is_removed": false
        },
        {
            "title": "What we Think we Know About Borderlands: The Pre-Sequel",
            "id": "6060",
            "slug": "what-we-think-we-know-about-borderlands-the-pre-sequel",
            "date": "2014-09-04",
            "is_first": false,
            "is_uploaded": true,
            "is_complete_upload": true,
            "is_removed": false
        },
        {
            "title": "Shadow of Mordor Orc Slaying 101| Pax Prime 2014",
            "id": "6059",
            "slug": "shadow-of-mordor-orc-slaying-101-pax-prime-2014",
            "date": "2014-09-04",
            "is_first": false,
            "is_uploaded": true,
            "is_complete_upload": true,
            "is_removed": false
        },
        {
            "title": "Mortal Kombat X Introduces New Faces and Fatalities | PAX Prime 2014",
            "id": "6058",
            "slug": "mortal-kombat-x-introduces-new-faces-and-fatalities-pax-prime-2014",
            "date": "2014-09-04",
            "is_first": false,
            "is_uploaded": true,
            "is_complete_upload": true,
            "is_removed": false
        },
        {
            "title": "Assassin's Creed Unity: New Co-op and Customization details! | PAX Prime 2014",
            "id": "6057",
            "slug": "assassins-creed-unity-new-co-op-and-customization-details-pax-prime-2014",
            "date": "2014-09-04",
            "is_first": false,
            "is_uploaded": true,
            "is_complete_upload": true,
            "is_removed": false
        },
        {
            "title": "Playing with Toy Soldiers: War Chest at PAX Prime '14 | ScrewAttack News",
            "id": "6056",
            "slug": "playing-with-toy-soldiers-war-chest-at-pax-prime-14-screwattack-news",
            "date": "2014-09-04",
            "is_first": false,
            "is_uploaded": true,
            "is_complete_upload": true,
            "is_removed": false
        },
        {
            "title": "What we THINK we know about EVOLVE",
            "id": "6055",
            "slug": "what-we-think-we-know-about-evolve",
            "date": "2014-08-29",
            "is_first": false,
            "is_uploaded": true,
            "is_complete_upload": true,
            "is_removed": false
        },
        {
            "title": "Behind the Scenes of SGC 2014 with Craig",
            "id": "6054",
            "slug": "behind-the-scenes-of-sgc-2014-with-craig",
            "date": "2014-08-27",
            "is_first": false,
            "is_uploaded": true,
            "is_complete_upload": true,
            "is_removed": false
        },
        {
            "title": "SideScrollers Extended Cut - 08/27/14",
            "id": "6053",
            "slug": "sidescrollers-extended-cut-082714",
            "date": "2014-08-27",
            "is_first": false,
            "is_uploaded": true,
            "is_complete_upload": true,
            "is_removed": false
        },
        {
            "title": "Watch the ScrewAttack Crew destroy the Pokemon theme song | Advantage Content",
            "id": "6052",
            "slug": "watch-the-screwattack-crew-destroy-the-pokemon-theme-song-advantage-content",
            "date": "2014-08-23",
            "is_first": false,
            "is_uploaded": true,
            "is_complete_upload": true,
            "is_removed": false
        },
        {
            "title": "Parker and John Accept Craig's #ALSIceBucketChallenge",
            "id": "6051",
            "slug": "parker-and-john-accept-craigs-alsicebucketchallenge",
            "date": "2014-08-22",
            "is_first": false,
            "is_uploaded": true,
            "is_complete_upload": true,
            "is_removed": false
        },
        {
            "title": "Craig Accepts the #ALSIceBucketChallenge",
            "id": "6050",
            "slug": "craig-accepts-the-alsicebucketchallenge",
            "date": "2014-08-20",
            "is_first": false,
            "is_uploaded": true,
            "is_complete_upload": true,
            "is_removed": false
        },
        {
            "title": "SideScrollers Extended Cut 08/20/14",
            "id": "6049",
            "slug": "sidescrollers-extended-cut-082014",
            "date": "2014-08-20",
            "is_first": false,
            "is_uploaded": true,
            "is_complete_upload": true,
            "is_removed": false
        },
        {
            "title": "Sam Vs. Wasp | Advantage Content",
            "id": "6048",
            "slug": "sam-vs-wasp-advantage-content",
            "date": "2014-08-19",
            "is_first": false,
            "is_uploaded": true,
            "is_complete_upload": true,
            "is_removed": false
        },
        {
            "title": "ScrewAttack Eats Crazy European Candy!",
            "id": "6046",
            "slug": "screwattack-eats-crazy-european-candy",
            "date": "2014-08-14",
            "is_first": false,
            "is_uploaded": true,
            "is_complete_upload": true,
            "is_removed": false
        },
        {
            "title": "ScrewAttack HQ Competition - Game #3 (Strikers 1945)",
            "id": "6045",
            "slug": "screwattack-hq-competition-game-3-strikers-1945",
            "date": "2014-08-13",
            "is_first": false,
            "is_uploaded": true,
            "is_complete_upload": true,
            "is_removed": false
        },
        {
            "title": "SideScrollers Extended Cut - 08/13/14",
            "id": "6044",
            "slug": "sidescrollers-extended-cut-081314",
            "date": "2014-08-13",
            "is_first": false,
            "is_uploaded": true,
            "is_complete_upload": true,
            "is_removed": false
        },
        {
            "title": "ScrewAttack HQ Competition - Game #2 (Puzzle Bobble VS Mode)",
            "id": "6043",
            "slug": "screwattack-hq-competition-game-2-puzzle-bobble-vs-mode",
            "date": "2014-08-12",
            "is_first": false,
            "is_uploaded": true,
            "is_complete_upload": true,
            "is_removed": false
        },
        {
            "title": "How fast is Craig's F-Zero run? | Advantage Content",
            "id": "6042",
            "slug": "how-fast-is-craigs-f-zero-run-advantage-content",
            "date": "2014-08-12",
            "is_first": false,
            "is_uploaded": true,
            "is_complete_upload": true,
            "is_removed": false
        },
        {
            "title": "ScrewAttack HQ Competition - Game #1 (F-Zero)",
            "id": "6041",
            "slug": "screwattack-hq-competition-game-1-f-zero",
            "date": "2014-08-11",
            "is_first": false,
            "is_uploaded": true,
            "is_complete_upload": true,
            "is_removed": false
        },
        {
            "title": "Closing sentimental thoughts on the old HQ",
            "id": "6040",
            "slug": "closing-sentimental-thoughts-on-the-old-hq",
            "date": "2014-08-06",
            "is_first": false,
            "is_uploaded": true,
            "is_complete_upload": true,
            "is_removed": false
        },
        {
            "title": "SideScrollers Extended Cut - 08/06/14",
            "id": "6039",
            "slug": "sidescrollers-extended-cut-080614",
            "date": "2014-08-06",
            "is_first": false,
            "is_uploaded": true,
            "is_complete_upload": true,
            "is_removed": false
        },
        {
            "title": "The Bug Eating Proposal | Advantage Content",
            "id": "6038",
            "slug": "the-bug-eating-proposal-advantage-content",
            "date": "2014-08-05",
            "is_first": false,
            "is_uploaded": true,
            "is_complete_upload": true,
            "is_removed": false
        },
        {
            "title": "SideScrollers Extended Cut - 7/23/14",
            "id": "6037",
            "slug": "sidescrollers-extended-cut-72314",
            "date": "2014-07-24",
            "is_first": false,
            "is_uploaded": true,
            "is_complete_upload": true,
            "is_removed": false
        },
        {
            "title": "SGC 2014 -Theorists Unite! Q&A with Game Theorists",
            "id": "6036",
            "slug": "sgc-2014-theorists-unite-qa-with-game-theorists",
            "date": "2014-07-23",
            "is_first": false,
            "is_uploaded": true,
            "is_complete_upload": true,
            "is_removed": false
        },
        {
            "title": "What happens behind the camera during Best EVER filming?",
            "id": "6035",
            "slug": "what-happens-behind-the-camera-during-best-ever-filming",
            "date": "2014-07-19",
            "is_first": false,
            "is_uploaded": true,
            "is_complete_upload": true,
            "is_removed": false
        },
        {
            "title": "SCREWATTACK CHEATS MEGA64? (SCAMATTACK?) - Mega64",
            "id": "6034",
            "slug": "screwattack-cheats-mega64-scamattack-mega64",
            "date": "2014-07-18",
            "is_first": false,
            "is_uploaded": true,
            "is_complete_upload": true,
            "is_removed": false
        },
        {
            "title": "Shhhh!  We're prankin' Sam! | Advantage Content",
            "id": "6032",
            "slug": "shhhh-were-prankin-sam-advantage-content",
            "date": "2014-07-08",
            "is_first": false,
            "is_uploaded": true,
            "is_complete_upload": true,
            "is_removed": false
        },
        {
            "title": "Bubble-Wrap Skin | Advantage Content",
            "id": "6033",
            "slug": "bubble-wrap-skin-advantage-content",
            "date": "2014-07-05",
            "is_first": false,
            "is_uploaded": true,
            "is_complete_upload": true,
            "is_removed": false
        },
        {
            "title": "Guile & Captain America defend FREEDOM!",
            "id": "6031",
            "slug": "guile-captain-america-defend-freedom",
            "date": "2014-07-04",
            "is_first": false,
            "is_uploaded": true,
            "is_complete_upload": true,
            "is_removed": false
        },
        {
            "title": "How'd we feel about Transformers 4: Age of Extinction?",
            "id": "6030",
            "slug": "howd-we-feel-about-transformers-4-age-of-extinction",
            "date": "2014-07-02",
            "is_first": false,
            "is_uploaded": true,
            "is_complete_upload": true,
            "is_removed": false
        },
        {
            "title": "Want to see how we disemboweled Shaun? THE CLIP | Exclusive Advantage Content",
            "id": "6029",
            "slug": "want-to-see-how-we-disemboweled-shaun-the-clip-exclusive-advantage-content",
            "date": "2014-07-02",
            "is_first": false,
            "is_uploaded": true,
            "is_complete_upload": true,
            "is_removed": false
        },
        {
            "title": "Spontaneous Questions - What are the crew's personal favorite games of all time? | Advantage Content",
            "id": "6028",
            "slug": "spontaneous-questions-what-are-the-crews-personal-favorite-games-of-all-time-advantage-content",
            "date": "2014-06-28",
            "is_first": false,
            "is_uploaded": true,
            "is_complete_upload": true,
            "is_removed": false
        },
        {
            "title": "Wanna see our new office space? | Advantage Content",
            "id": "6027",
            "slug": "wanna-see-our-new-office-space-advantage-content",
            "date": "2014-06-24",
            "is_first": false,
            "is_uploaded": true,
            "is_complete_upload": true,
            "is_removed": false
        },
        {
            "title": "MEGA64 ARE HEATHENS AND WILL BE SENT TO HELL!",
            "id": "6026",
            "slug": "mega64-are-heathens-and-will-be-sent-to-hell",
            "date": "2014-06-22",
            "is_first": false,
            "is_uploaded": true,
            "is_complete_upload": true,
            "is_removed": false
        },
        {
            "title": "The Laugh Circle | Advantage-Exclusive Content",
            "id": "6025",
            "slug": "the-laugh-circle-advantage-exclusive-content",
            "date": "2014-06-21",
            "is_first": false,
            "is_uploaded": true,
            "is_complete_upload": true,
            "is_removed": false
        },
        {
            "title": "Ghost Recon Phantoms: Rocksteady Part 2",
            "id": "6024",
            "slug": "ghost-recon-phantoms-rocksteady-part-2",
            "date": "2014-06-15",
            "is_first": false,
            "is_uploaded": true,
            "is_complete_upload": true,
            "is_removed": false
        },
        {
            "title": "Ghost Recon Phantoms: Rocksteady Part 1",
            "id": "6023",
            "slug": "ghost-recon-phantoms-rocksteady-part-1",
            "date": "2014-06-15",
            "is_first": false,
            "is_uploaded": true,
            "is_complete_upload": true,
            "is_removed": false
        },
        {
            "title": "Day in the life - ScrewAttack through the eyes of Shaun(tern) | Exclusive Advantage Content",
            "id": "6022",
            "slug": "day-in-the-life-screwattack-through-the-eyes-of-shaun-tern-exclusive-advantage-content",
            "date": "2014-06-07",
            "is_first": false,
            "is_uploaded": true,
            "is_complete_upload": true,
            "is_removed": false
        },
        {
            "title": "E3 Overtime 2014 with Geoff Keighley! (Starring Geoff Keighley!)",
            "id": "6020",
            "slug": "e3-overtime-2014-with-geoff-keighley-starring-geoff-keighley",
            "date": "2014-06-06",
            "is_first": false,
            "is_uploaded": true,
            "is_complete_upload": true,
            "is_removed": false
        },
        {
            "title": "MEGA64 promises to destroy everyone at SGC 2014",
            "id": "6021",
            "slug": "mega64-promises-to-destroy-everyone-at-sgc-2014",
            "date": "2014-06-05",
            "is_first": false,
            "is_uploaded": true,
            "is_complete_upload": true,
            "is_removed": false
        },
        {
            "title": "You decide the fate of this clip!",
            "id": "6019",
            "slug": "you-decide-the-fate-of-this-clip",
            "date": "2014-06-04",
            "is_first": false,
            "is_uploaded": true,
            "is_complete_upload": true,
            "is_removed": false
        },
        {
            "title": "Mortal Kombat X: What we THINK we know",
            "id": "6018",
            "slug": "mortal-kombat-x-what-we-think-we-know",
            "date": "2014-06-02",
            "is_first": false,
            "is_uploaded": true,
            "is_complete_upload": true,
            "is_removed": false
        },
        {
            "title": "Nothing's Changed at ScrewAttack...Nothing At All",
            "id": "6017",
            "slug": "nothings-changed-at-screwattack-nothing-at-all",
            "date": "2014-05-31",
            "is_first": false,
            "is_uploaded": true,
            "is_complete_upload": true,
            "is_removed": false
        },
        {
            "title": "Here's a sneak peak at what Advantage users saw (and stuff they haven't yet) over the past month.",
            "id": "6016",
            "slug": "heres-a-sneak-peak-at-what-advantage-users-saw-and-stuff-they-havent-yet-over-the-past-month",
            "date": "2014-05-28",
            "is_first": false,
            "is_uploaded": true,
            "is_complete_upload": true,
            "is_removed": false
        },
        {
            "title": "Want to see how we voice a DEATH BATTLE!? | Exclusive Advantage Content",
            "id": "6015",
            "slug": "want-to-see-how-we-voice-a-death-battle-exclusive-advantage-content",
            "date": "2014-05-27",
            "is_first": false,
            "is_uploaded": true,
            "is_complete_upload": true,
            "is_removed": false
        },
        {
            "title": "[Hypothetically] Who would Krillin fight in a DEATH BATTLE!?  Wiz weighs in! | Exclusive Advantage Content",
            "id": "6014",
            "slug": "hypothetically-who-would-krillin-fight-in-a-death-battle-wiz-weighs-in-exclusive-advantage-content",
            "date": "2014-05-24",
            "is_first": false,
            "is_uploaded": true,
            "is_complete_upload": true,
            "is_removed": false
        },
        {
            "title": "The entire crew's Top 3 Jean Claude Van Damme Films | Advantage Content",
            "id": "6013",
            "slug": "the-entire-crews-top-3-jean-claude-van-damme-films-advantage-content",
            "date": "2014-05-20",
            "is_first": false,
            "is_uploaded": true,
            "is_complete_upload": true,
            "is_removed": false
        },
        {
            "title": "Nick reads hateful Youtube comments | Exclusive Advantage Content",
            "id": "6012",
            "slug": "nick-reads-hateful-youtube-comments-exclusive-advantage-content",
            "date": "2014-05-17",
            "is_first": false,
            "is_uploaded": true,
            "is_complete_upload": true,
            "is_removed": false
        },
        {
            "title": "From \"Bombshell\" to BOMBSHELL! | Random Awesomeness",
            "id": "6011",
            "slug": "from-bombshell-to-bombshell-random-awesomeness",
            "date": "2014-05-15",
            "is_first": false,
            "is_uploaded": true,
            "is_complete_upload": true,
            "is_removed": false
        },
        {
            "title": "What's a \"penis snake?\" | Exclusive Advantage Content",
            "id": "6010",
            "slug": "whats-a-penis-snake-exclusive-advantage-content",
            "date": "2014-05-14",
            "is_first": false,
            "is_uploaded": true,
            "is_complete_upload": true,
            "is_removed": false
        },
        {
            "title": "Nick and Chad's reactions to fighting MAXIMILIAN in 3rd Strike | Advantage Content",
            "id": "6009",
            "slug": "nick-and-chads-reactions-to-fighting-maximilian-in-3rd-strike-advantage-content",
            "date": "2014-05-13",
            "is_first": false,
            "is_uploaded": true,
            "is_complete_upload": true,
            "is_removed": false
        },
        {
            "title": "What slushie flavor is each member of the ScrewAttack Crew? | Exclusive Advantage Content",
            "id": "6008",
            "slug": "what-slushie-flavor-is-each-member-of-the-screwattack-crew-exclusive-advantage-content",
            "date": "2014-05-11",
            "is_first": false,
            "is_uploaded": true,
            "is_complete_upload": true,
            "is_removed": false
        },
        {
            "title": "Sam's Worst Controller EVER!",
            "id": "6007",
            "slug": "sams-worst-controller-ever",
            "date": "2014-05-09",
            "is_first": false,
            "is_uploaded": true,
            "is_complete_upload": true,
            "is_removed": false
        },
        {
            "title": "Shaun(tern)'s audition to be a DEATH BATTLE! animator | Advantage-Exclusive Content",
            "id": "6006",
            "slug": "shaun-tern-s-audition-to-be-a-death-battle-animator-advantage-exclusive-content",
            "date": "2014-05-08",
            "is_first": false,
            "is_uploaded": true,
            "is_complete_upload": true,
            "is_removed": false
        },
        {
            "title": "Craig VS Ben - Time for ScrewAttack Jam!",
            "id": "6005",
            "slug": "craig-vs-ben-time-for-screwattack-jam",
            "date": "2014-05-07",
            "is_first": false,
            "is_uploaded": true,
            "is_complete_upload": true,
            "is_removed": false
        },
        {
            "title": "Eating two-year-old swag! | Advantage Exclusive Content",
            "id": "6004",
            "slug": "eating-two-year-old-swag-advantage-exclusive-content",
            "date": "2014-05-06",
            "is_first": false,
            "is_uploaded": true,
            "is_complete_upload": true,
            "is_removed": false
        },
        {
            "title": "Broforce, the Manliest Game at PAX East 2014! | PAX East 2014",
            "id": "6003",
            "slug": "broforce-the-manliest-game-at-pax-east-2014-pax-east-2014",
            "date": "2014-05-01",
            "is_first": false,
            "is_uploaded": true,
            "is_complete_upload": true,
            "is_removed": false
        },
        {
            "title": "Organic Panic | PAX East 2014 | ScrewAttack",
            "id": "6002",
            "slug": "organic-panic-pax-east-2014-screwattack",
            "date": "2014-04-30",
            "is_first": false,
            "is_uploaded": true,
            "is_complete_upload": true,
            "is_removed": false
        },
        {
            "title": "Why Superman 64 is truly the worst superhero game EVER!",
            "id": "6001",
            "slug": "why-superman-64-is-truly-the-worst-superhero-game-ever",
            "date": "2014-04-26",
            "is_first": false,
            "is_uploaded": true,
            "is_complete_upload": true,
            "is_removed": false
        },
        {
            "title": "Watch Dogs: Our Hands On Impressions!",
            "id": "6000",
            "slug": "watch-dogs-our-hands-on-impressions",
            "date": "2014-04-23",
            "is_first": false,
            "is_uploaded": true,
            "is_complete_upload": true,
            "is_removed": false
        },
        {
            "title": "Find employment with Invisible Inc | PAX East 2014",
            "id": "5999",
            "slug": "find-employment-with-invisible-inc-pax-east-2014",
            "date": "2014-04-23",
            "is_first": false,
            "is_uploaded": true,
            "is_complete_upload": true,
            "is_removed": false
        },
        {
            "title": "Catlateral Damage: CAT SIMULATOR! | PAX East 2014",
            "id": "5998",
            "slug": "catlateral-damage-cat-simulator-pax-east-2014",
            "date": "2014-04-23",
            "is_first": false,
            "is_uploaded": true,
            "is_complete_upload": true,
            "is_removed": false
        },
        {
            "title": "Videoball: Get Hyped or GTFO the Universe | PAX East 2014",
            "id": "5997",
            "slug": "videoball-get-hyped-or-gtfo-the-universe-pax-east-2014",
            "date": "2014-04-21",
            "is_first": false,
            "is_uploaded": true,
            "is_complete_upload": true,
            "is_removed": false
        },
        {
            "title": "Project Totem's sidescrolling puzzle madness! | PAX East 2014",
            "id": "5996",
            "slug": "project-totems-sidescrolling-puzzle-madness-pax-east-2014",
            "date": "2014-04-21",
            "is_first": false,
            "is_uploaded": true,
            "is_complete_upload": true,
            "is_removed": false
        },
        {
            "title": "Indie Van Game Jam | PAX East 2014",
            "id": "5995",
            "slug": "indie-van-game-jam-pax-east-2014",
            "date": "2014-04-21",
            "is_first": false,
            "is_uploaded": true,
            "is_complete_upload": true,
            "is_removed": false
        },
        {
            "title": "Last Life got a Double Fine adrenaline shot at PAX East 2014",
            "id": "5994",
            "slug": "last-life-got-a-double-fine-adrenaline-shot-at-pax-east-2014",
            "date": "2014-04-19",
            "is_first": false,
            "is_uploaded": true,
            "is_complete_upload": true,
            "is_removed": false
        },
        {
            "title": "Darknet brings 90s hacker movies to life at PAX East 2014",
            "id": "5993",
            "slug": "darknet-brings-90s-hacker-movies-to-life-at-pax-east-2014",
            "date": "2014-04-19",
            "is_first": false,
            "is_uploaded": true,
            "is_complete_upload": true,
            "is_removed": false
        },
        {
            "title": "Max Gentlemen manhandles all the other \"manly\" games! - PAX East 2014",
            "id": "5992",
            "slug": "max-gentlemen-manhandles-all-the-other-manly-games-pax-east-2014",
            "date": "2014-04-19",
            "is_first": false,
            "is_uploaded": true,
            "is_complete_upload": true,
            "is_removed": false
        },
        {
            "title": "Aztez interview from atop a mighty throne! PAX East 2014 | ScrewAttack",
            "id": "5991",
            "slug": "aztez-interview-from-atop-a-mighty-throne-pax-east-2014-screwattack",
            "date": "2014-04-18",
            "is_first": false,
            "is_uploaded": true,
            "is_complete_upload": true,
            "is_removed": false
        },
        {
            "title": "Nosgoth may suck all your time away - PAX East 2014",
            "id": "5990",
            "slug": "nosgoth-may-suck-all-your-time-away-pax-east-2014",
            "date": "2014-04-18",
            "is_first": false,
            "is_uploaded": true,
            "is_complete_upload": true,
            "is_removed": false
        },
        {
            "title": "Murdered: Soul Suspect is a ghostly good time at PAX East 2014",
            "id": "5989",
            "slug": "murdered-soul-suspect-is-a-ghostly-good-time-at-pax-east-2014",
            "date": "2014-04-18",
            "is_first": false,
            "is_uploaded": true,
            "is_complete_upload": true,
            "is_removed": false
        },
        {
            "title": "Evolve will be the next big thing in multiplayer",
            "id": "5988",
            "slug": "evolve-will-be-the-next-big-thing-in-multiplayer",
            "date": "2014-04-18",
            "is_first": false,
            "is_uploaded": true,
            "is_complete_upload": true,
            "is_removed": false
        },
        {
            "title": "Craig vs Black Nerd Comedy: Test of Inflatable Might",
            "id": "5987",
            "slug": "craig-vs-black-nerd-comedy-test-of-inflatable-might",
            "date": "2014-04-17",
            "is_first": false,
            "is_uploaded": true,
            "is_complete_upload": true,
            "is_removed": false
        },
        {
            "title": "An interview with one of the geniuses behind JetGetters",
            "id": "5986",
            "slug": "an-interview-with-one-of-the-geniuses-behind-jetgetters",
            "date": "2014-04-17",
            "is_first": false,
            "is_uploaded": true,
            "is_complete_upload": true,
            "is_removed": false
        },
        {
            "title": "PAX East 2014 - Borderlands The Pre-Sequel Impressions!",
            "id": "5985",
            "slug": "pax-east-2014-borderlands-the-pre-sequel-impressions",
            "date": "2014-04-16",
            "is_first": false,
            "is_uploaded": true,
            "is_complete_upload": true,
            "is_removed": false
        },
        {
            "title": "Get the scoop on Hotline Miami 2: Wrong Number!",
            "id": "5984",
            "slug": "get-the-scoop-on-hotline-miami-2-wrong-number",
            "date": "2014-04-16",
            "is_first": false,
            "is_uploaded": true,
            "is_complete_upload": true,
            "is_removed": false
        },
        {
            "title": "Hard News Outtakes - Stories with Sean",
            "id": "5982",
            "slug": "hard-news-outtakes-stories-with-sean",
            "date": "2014-04-01",
            "is_first": false,
            "is_uploaded": true,
            "is_complete_upload": true,
            "is_removed": false
        },
        {
            "title": "Introducing the ScrewAttack Network",
            "id": "5981",
            "slug": "introducing-the-screwattack-network",
            "date": "2014-03-28",
            "is_first": false,
            "is_uploaded": true,
            "is_complete_upload": true,
            "is_removed": false
        },
        {
            "title": "Vegeta VS Mewtwo? - DEATH BATTLE vs SILVERMANIA",
            "id": "5980",
            "slug": "vegeta-vs-mewtwo-death-battle-vs-silvermania",
            "date": "2014-03-28",
            "is_first": false,
            "is_uploaded": true,
            "is_complete_upload": true,
            "is_removed": false
        },
        {
            "title": "The Capri Sun Challenge",
            "id": "5978",
            "slug": "the-capri-sun-challenge",
            "date": "2014-03-19",
            "is_first": false,
            "is_uploaded": true,
            "is_complete_upload": true,
            "is_removed": false
        },
        {
            "title": "Sean's Best TMNT Character EVER!",
            "id": "5977",
            "slug": "seans-best-tmnt-character-ever",
            "date": "2014-03-15",
            "is_first": false,
            "is_uploaded": true,
            "is_complete_upload": true,
            "is_removed": false
        },
        {
            "title": "Nick's Worst EVER Smash Bros. Character",
            "id": "5976",
            "slug": "nicks-worst-ever-smash-bros-character",
            "date": "2014-03-08",
            "is_first": false,
            "is_uploaded": true,
            "is_complete_upload": true,
            "is_removed": false
        },
        {
            "title": "The Manliest Candy",
            "id": "5975",
            "slug": "the-manliest-candy",
            "date": "2014-03-05",
            "is_first": false,
            "is_uploaded": true,
            "is_complete_upload": true,
            "is_removed": false
        },
        {
            "title": "Hard News - The \"Antonia Bottino\" Trial",
            "id": "5974",
            "slug": "hard-news-the-antonia-bottino-trial",
            "date": "2014-02-27",
            "is_first": false,
            "is_uploaded": true,
            "is_complete_upload": true,
            "is_removed": false
        },
        {
            "title": "Hey ScrewAttack Community! Here's What's Up Next Week!",
            "id": "5973",
            "slug": "hey-screwattack-community-heres-whats-up-next-week",
            "date": "2014-02-22",
            "is_first": false,
            "is_uploaded": true,
            "is_complete_upload": true,
            "is_removed": false
        },
        {
            "title": "Classic Sunday - Unaware Steve's Quakecon Debut",
            "id": "5972",
            "slug": "classic-sunday-unaware-steves-quakecon-debut",
            "date": "2014-02-08",
            "is_first": false,
            "is_uploaded": true,
            "is_complete_upload": true,
            "is_removed": false
        },
        {
            "title": "Craig's Worst EVER Reimagining UNCUT",
            "id": "5971",
            "slug": "craigs-worst-ever-reimagining-uncut",
            "date": "2014-02-07",
            "is_first": false,
            "is_uploaded": true,
            "is_complete_upload": true,
            "is_removed": false
        },
        {
            "title": "The Best Yoshi's Island Player Alive",
            "id": "5970",
            "slug": "the-best-yoshis-island-player-alive",
            "date": "2014-02-07",
            "is_first": false,
            "is_uploaded": true,
            "is_complete_upload": true,
            "is_removed": false
        },
        {
            "title": "Cat and Dinosaur Super DVD Sale! - ScrewAttackStore.com",
            "id": "5969",
            "slug": "cat-and-dinosaur-super-dvd-sale-screwattackstore-com",
            "date": "2014-02-01",
            "is_first": false,
            "is_uploaded": true,
            "is_complete_upload": true,
            "is_removed": false
        },
        {
            "title": "Dr. PeePee is the Best Smash Bros Melee player in the world",
            "id": "5968",
            "slug": "dr-peepee-is-the-best-smash-bros-melee-player-in-the-world",
            "date": "2014-01-31",
            "is_first": false,
            "is_uploaded": true,
            "is_complete_upload": true,
            "is_removed": false
        },
        {
            "title": "[Advantage] Dia De Huevos live stream opening",
            "id": "5967",
            "slug": "advantage-dia-de-huevos-live-stream-opening",
            "date": "2014-01-20",
            "is_first": false,
            "is_uploaded": true,
            "is_complete_upload": true,
            "is_removed": false
        },
        {
            "title": "Chad's worst EVER villain!",
            "id": "5966",
            "slug": "chads-worst-ever-villain",
            "date": "2014-01-18",
            "is_first": false,
            "is_uploaded": true,
            "is_complete_upload": true,
            "is_removed": false
        },
        {
            "title": "Hot Cosplay of MAGFest 12",
            "id": "5965",
            "slug": "hot-cosplay-of-magfest-12",
            "date": "2014-01-15",
            "is_first": false,
            "is_uploaded": true,
            "is_complete_upload": true,
            "is_removed": false
        },
        {
            "title": "Making the AVGN Game",
            "id": "5964",
            "slug": "making-the-avgn-game",
            "date": "2014-01-08",
            "is_first": false,
            "is_uploaded": true,
            "is_complete_upload": true,
            "is_removed": false
        },
        {
            "title": "Nintendo vs Sega with Emmitt Smith",
            "id": "5963",
            "slug": "nintendo-vs-sega-with-emmitt-smith",
            "date": "2014-01-06",
            "is_first": false,
            "is_uploaded": true,
            "is_complete_upload": true,
            "is_removed": false
        },
        {
            "title": "The 2013 ScrewAttack Royal Rumble!",
            "id": "5962",
            "slug": "the-2013-screwattack-royal-rumble",
            "date": "2014-01-01",
            "is_first": false,
            "is_uploaded": true,
            "is_complete_upload": true,
            "is_removed": false
        },
        {
            "title": "2013 SAGYs - The Winner for Worst Multiplatform Game is...",
            "id": "5961",
            "slug": "2013-sagys-the-winner-for-worst-multiplatform-game-is",
            "date": "2013-12-27",
            "is_first": false,
            "is_uploaded": true,
            "is_complete_upload": true,
            "is_removed": false
        },
        {
            "title": "2013 SAGYs - The Winner for Worst Portable Game is...",
            "id": "5960",
            "slug": "2013-sagys-the-winner-for-worst-portable-game-is",
            "date": "2013-12-26",
            "is_first": false,
            "is_uploaded": true,
            "is_complete_upload": true,
            "is_removed": false
        },
        {
            "title": "Christmas with ScrewAttack!",
            "id": "5959",
            "slug": "christmas-with-screwattack",
            "date": "2013-12-25",
            "is_first": false,
            "is_uploaded": true,
            "is_complete_upload": true,
            "is_removed": false
        },
        {
            "title": "2013 SAGYs - The Winner for Worst Wii U Game is...",
            "id": "5958",
            "slug": "2013-sagys-the-winner-for-worst-wii-u-game-is",
            "date": "2013-12-25",
            "is_first": false,
            "is_uploaded": true,
            "is_complete_upload": true,
            "is_removed": false
        },
        {
            "title": "2013 SAGYs - The Winner for Worst Game on a Microsoft Console is...",
            "id": "5957",
            "slug": "2013-sagys-the-winner-for-worst-game-on-a-microsoft-console-is",
            "date": "2013-12-24",
            "is_first": false,
            "is_uploaded": true,
            "is_complete_upload": true,
            "is_removed": false
        },
        {
            "title": "2013 SAGYs - The Winner for Worst Game on a Sony Console is...",
            "id": "5956",
            "slug": "2013-sagys-the-winner-for-worst-game-on-a-sony-console-is",
            "date": "2013-12-23",
            "is_first": false,
            "is_uploaded": true,
            "is_complete_upload": true,
            "is_removed": false
        },
        {
            "title": "Bonestorm vs Rocket Death Lions - The Bottoms Up Cup",
            "id": "5955",
            "slug": "bonestorm-vs-rocket-death-lions-the-bottoms-up-cup",
            "date": "2013-12-20",
            "is_first": false,
            "is_uploaded": true,
            "is_complete_upload": true,
            "is_removed": false
        },
        {
            "title": "SideScrollers Extended - 12/18/13",
            "id": "5954",
            "slug": "sidescrollers-extended-121813",
            "date": "2013-12-18",
            "is_first": false,
            "is_uploaded": true,
            "is_complete_upload": true,
            "is_removed": false
        },
        {
            "title": "Nick's Best EVER Holiday Gaming Gift",
            "id": "5953",
            "slug": "nicks-best-ever-holiday-gaming-gift",
            "date": "2013-12-14",
            "is_first": false,
            "is_uploaded": true,
            "is_complete_upload": true,
            "is_removed": false
        },
        {
            "title": "The Nominees for Worst Multi-Platform Game in 2013 are...",
            "id": "5952",
            "slug": "the-nominees-for-worst-multi-platform-game-in-2013-are",
            "date": "2013-12-13",
            "is_first": false,
            "is_uploaded": true,
            "is_complete_upload": true,
            "is_removed": false
        },
        {
            "title": "The Nominees for Worst Portable Game in 2013 are...",
            "id": "5951",
            "slug": "the-nominees-for-worst-portable-game-in-2013-are",
            "date": "2013-12-12",
            "is_first": false,
            "is_uploaded": true,
            "is_complete_upload": true,
            "is_removed": false
        },
        {
            "title": "SideScrollers Extended - 12/11/13",
            "id": "5950",
            "slug": "sidescrollers-extended-121113",
            "date": "2013-12-11",
            "is_first": false,
            "is_uploaded": true,
            "is_complete_upload": true,
            "is_removed": false
        },
        {
            "title": "The Nominees for Worst Game on the Wii U in 2013 are...",
            "id": "5949",
            "slug": "the-nominees-for-worst-game-on-the-wii-u-in-2013-are",
            "date": "2013-12-11",
            "is_first": false,
            "is_uploaded": true,
            "is_complete_upload": true,
            "is_removed": false
        },
        {
            "title": "The 2013 SAGYs - Worst Microsoft Console Game Nominations",
            "id": "5948",
            "slug": "the-2013-sagys-worst-microsoft-console-game-nominations",
            "date": "2013-12-10",
            "is_first": false,
            "is_uploaded": true,
            "is_complete_upload": true,
            "is_removed": false
        },
        {
            "title": "The Nominees for Worst Game on a Sony Console in 2013 are...",
            "id": "5947",
            "slug": "the-nominees-for-worst-game-on-a-sony-console-in-2013-are",
            "date": "2013-12-09",
            "is_first": false,
            "is_uploaded": true,
            "is_complete_upload": true,
            "is_removed": false
        },
        {
            "title": "Craig's Worst EVER Videogame Movie!",
            "id": "5946",
            "slug": "craigs-worst-ever-videogame-movie",
            "date": "2013-12-07",
            "is_first": false,
            "is_uploaded": true,
            "is_complete_upload": true,
            "is_removed": false
        },
        {
            "title": "The Fruit Snack Challenge!",
            "id": "5945",
            "slug": "the-fruit-snack-challenge",
            "date": "2013-12-05",
            "is_first": false,
            "is_uploaded": true,
            "is_complete_upload": true,
            "is_removed": false
        },
        {
            "title": "SideScrollers Extended - 12/04/13",
            "id": "5944",
            "slug": "sidescrollers-extended-120413",
            "date": "2013-12-04",
            "is_first": false,
            "is_uploaded": true,
            "is_complete_upload": true,
            "is_removed": false
        },
        {
            "title": "Totally Screwed Up Bloopers and Outtakes",
            "id": "5943",
            "slug": "totally-screwed-up-bloopers-and-outtakes",
            "date": "2013-12-02",
            "is_first": false,
            "is_uploaded": true,
            "is_complete_upload": true,
            "is_removed": false
        },
        {
            "title": "The 2013 Shitty Ass Game of the Year Awards are here!",
            "id": "5942",
            "slug": "the-2013-shitty-ass-game-of-the-year-awards-are-here",
            "date": "2013-12-02",
            "is_first": false,
            "is_uploaded": true,
            "is_complete_upload": true,
            "is_removed": false
        },
        {
            "title": "ScrewAttackStore's Biggest Black Friday Sale in History",
            "id": "5941",
            "slug": "screwattackstores-biggest-black-friday-sale-in-history",
            "date": "2013-11-28",
            "is_first": false,
            "is_uploaded": true,
            "is_complete_upload": true,
            "is_removed": false
        },
        {
            "title": "SA Wrestling presents TOTALLY SCREWED!!! - Part 1 - Overdrinker Overkill!",
            "id": "5939",
            "slug": "sa-wrestling-presents-totally-screwed-part-1-overdrinker-overkill",
            "date": "2013-11-28",
            "is_first": false,
            "is_uploaded": true,
            "is_complete_upload": true,
            "is_removed": false
        },
        {
            "title": "SA Wrestling presents TOTALLY SCREWED!!! - Part 2 - The DEATH BATTLE! Duel!",
            "id": "5940",
            "slug": "sa-wrestling-presents-totally-screwed-part-2-the-death-battle-duel",
            "date": "2013-11-28",
            "is_first": false,
            "is_uploaded": true,
            "is_complete_upload": true,
            "is_removed": false
        },
        {
            "title": "SA Wrestling presents TOTALLY SCREWED!!! - Part 3 - Out of the Box and Into the Cage!",
            "id": "5938",
            "slug": "sa-wrestling-presents-totally-screwed-part-3-out-of-the-box-and-into-the-cage",
            "date": "2013-11-28",
            "is_first": false,
            "is_uploaded": true,
            "is_complete_upload": true,
            "is_removed": false
        },
        {
            "title": "SA Wrestling presents TOTALLY SCREWED!!! - Part 4 - The Frontroom Feud!",
            "id": "5936",
            "slug": "sa-wrestling-presents-totally-screwed-part-4-the-frontroom-feud",
            "date": "2013-11-28",
            "is_first": false,
            "is_uploaded": true,
            "is_complete_upload": true,
            "is_removed": false
        },
        {
            "title": "SA Wrestling presents TOTALLY SCREWED!!! - Part 5 - The Top Ten Tussle!",
            "id": "5937",
            "slug": "sa-wrestling-presents-totally-screwed-part-5-the-top-ten-tussle",
            "date": "2013-11-28",
            "is_first": false,
            "is_uploaded": true,
            "is_complete_upload": true,
            "is_removed": false
        },
        {
            "title": "SA Wrestling presents TOTALLY SCREWED!!! - Part 6 - The Classmate Clash!",
            "id": "5935",
            "slug": "sa-wrestling-presents-totally-screwed-part-6-the-classmate-clash",
            "date": "2013-11-28",
            "is_first": false,
            "is_uploaded": true,
            "is_complete_upload": true,
            "is_removed": false
        },
        {
            "title": "SA Wrestling presents TOTALLY SCREWED!!! - Part 7 - The Hard News Hardcore Triple Threat Match!",
            "id": "5934",
            "slug": "sa-wrestling-presents-totally-screwed-part-7-the-hard-news-hardcore-triple-threat-match",
            "date": "2013-11-28",
            "is_first": false,
            "is_uploaded": true,
            "is_complete_upload": true,
            "is_removed": false
        },
        {
            "title": "SideScrollers Extended - 11/27/13",
            "id": "5933",
            "slug": "sidescrollers-extended-112713",
            "date": "2013-11-27",
            "is_first": false,
            "is_uploaded": true,
            "is_complete_upload": true,
            "is_removed": false
        },
        {
            "title": "The Greatest Xbox One Unboxing Ever!",
            "id": "5932",
            "slug": "the-greatest-xbox-one-unboxing-ever",
            "date": "2013-11-25",
            "is_first": false,
            "is_uploaded": true,
            "is_complete_upload": true,
            "is_removed": false
        },
        {
            "title": "Play Killer Instinct with Chad on Gameday!",
            "id": "5931",
            "slug": "play-killer-instinct-with-chad-on-gameday",
            "date": "2013-11-23",
            "is_first": false,
            "is_uploaded": true,
            "is_complete_upload": true,
            "is_removed": false
        },
        {
            "title": "SideScrollers Extended - 11/20/13",
            "id": "5930",
            "slug": "sidescrollers-extended-112013",
            "date": "2013-11-20",
            "is_first": false,
            "is_uploaded": true,
            "is_complete_upload": true,
            "is_removed": false
        },
        {
            "title": "The Greatest PS4 Unboxing Ever",
            "id": "5929",
            "slug": "the-greatest-ps4-unboxing-ever",
            "date": "2013-11-19",
            "is_first": false,
            "is_uploaded": true,
            "is_complete_upload": true,
            "is_removed": false
        },
        {
            "title": "The Greatest PlayStation 4 Unboxing Video Ever",
            "id": "5916",
            "slug": "the-greatest-playstation-4-unboxing-video-ever",
            "date": "2013-11-15",
            "is_first": false,
            "is_uploaded": true,
            "is_complete_upload": true,
            "is_removed": false
        },
        {
            "title": "SideScrollers Extended - 11/13/13",
            "id": "5914",
            "slug": "sidescrollers-extended-111313",
            "date": "2013-11-13",
            "is_first": false,
            "is_uploaded": true,
            "is_complete_upload": true,
            "is_removed": false
        },
        {
            "title": "Bottoms Up Cup - Rocket Death Lions VS Slothcano (NBA Jam, Smash Bros Brawl, Mario Kart)",
            "id": "5913",
            "slug": "bottoms-up-cup-rocket-death-lions-vs-slothcano-nba-jam-smash-bros-brawl-mario-kart",
            "date": "2013-11-09",
            "is_first": false,
            "is_uploaded": true,
            "is_complete_upload": true,
            "is_removed": false
        },
        {
            "title": "Sean's Best EVER Hidden Gem",
            "id": "5912",
            "slug": "seans-best-ever-hidden-gem",
            "date": "2013-11-09",
            "is_first": false,
            "is_uploaded": true,
            "is_complete_upload": true,
            "is_removed": false
        },
        {
            "title": "Sam? How Much is Shirt? - Deal of the Week",
            "id": "5911",
            "slug": "sam-how-much-is-shirt-deal-of-the-week",
            "date": "2013-11-07",
            "is_first": false,
            "is_uploaded": true,
            "is_complete_upload": true,
            "is_removed": false
        },
        {
            "title": "SideScrollers Extended - 11/06/13",
            "id": "5909",
            "slug": "sidescrollers-extended-110613",
            "date": "2013-11-06",
            "is_first": false,
            "is_uploaded": true,
            "is_complete_upload": true,
            "is_removed": false
        },
        {
            "title": "13 Xbox One game impressions in under a minute!",
            "id": "5910",
            "slug": "13-xbox-one-game-impressions-in-under-a-minute",
            "date": "2013-11-04",
            "is_first": false,
            "is_uploaded": true,
            "is_complete_upload": true,
            "is_removed": false
        },
        {
            "title": "The Return of Commie Chomps",
            "id": "5908",
            "slug": "the-return-of-commie-chomps",
            "date": "2013-11-01",
            "is_first": false,
            "is_uploaded": true,
            "is_complete_upload": true,
            "is_removed": false
        },
        {
            "title": "Zelda: A Link Between Worlds lets you smash faces with a hammer",
            "id": "5907",
            "slug": "zelda-a-link-between-worlds-lets-you-smash-faces-with-a-hammer",
            "date": "2013-11-01",
            "is_first": false,
            "is_uploaded": true,
            "is_complete_upload": true,
